{
  "$schema": "../../../schemas/tool-contract.schema.json",
  "schema_version": "1.0.0",
  "tool_id": "retrieve_policy",
  "version": "1.0.0",
  "owner": "finance-controls",
  "purpose": "Retrieve the current tenant-bound invoice-resolution policy and decision constraints",
  "kind": "query",
  "input_schema": {
    "type": "object",
    "additionalProperties": false,
    "required": ["tenant_id", "policy_id", "as_of"],
    "properties": {
      "tenant_id": { "type": "string" },
      "policy_id": { "type": "string" },
      "as_of": { "type": "string", "format": "date-time" }
    }
  },
  "output_schema": {
    "type": "object",
    "additionalProperties": false,
    "required": ["policy_id", "revision", "effective_at", "constraints", "observed_at"],
    "properties": {
      "policy_id": { "type": "string" },
      "revision": { "type": "string" },
      "effective_at": { "type": "string", "format": "date-time" },
      "constraints": { "type": "object" },
      "observed_at": { "type": "string", "format": "date-time" }
    }
  },
  "error_schema": {
    "type": "object",
    "additionalProperties": false,
    "required": ["code", "message", "retryable"],
    "properties": {
      "code": { "type": "string", "pattern": "^[A-Z][A-Z0-9_]+$" },
      "message": { "type": "string", "minLength": 1 },
      "retryable": { "type": "boolean" }
    }
  },
  "authorization": {
    "agent_principal": "invoice-exception-workload",
    "caller_context_required": true,
    "required_scopes": ["finance-policy:read"],
    "policy_decision_point": "tool-gateway",
    "tenant_binding": true,
    "fail_mode": "closed"
  },
  "execution": {
    "timeout_ms": 3000,
    "max_attempts": 2,
    "retryable_errors": ["TIMEOUT", "UNAVAILABLE"],
    "idempotency": { "required": false, "key_fields": [], "enforced_by": "not-applicable" }
  },
  "side_effects": { "class": "none", "resources": [], "compensation": null },
  "approval": { "required": false, "role": null, "proposal_digest_required": false, "expires_seconds": null },
  "network": { "egress": "allowlist", "destinations": ["finance-policy.internal"], "credential_broker": "workload-identity-gateway" },
  "failure_modes": [
    { "code": "STALE_POLICY", "class": "escalation", "retry": false, "escalate": true },
    { "code": "POLICY_DENIED", "class": "authorization", "retry": false, "escalate": true },
    { "code": "TIMEOUT", "class": "retryable", "retry": true, "escalate": false }
  ],
  "observability": { "span_name": "agent.tool.retrieve_policy", "audit_event": "finance_policy.read", "redacted_fields": [], "postcondition_readback": false },
  "invariants": ["policy revision is active at as_of", "policy tenant equals authorized tenant"],
  "control_ids": ["CTX-001", "TOL-001", "IAM-002", "IAM-003", "SEC-005"]
}
